{"baseline": "seed-registry", "baseline_comparison": {"baseline": "seed-registry", "benchmark_task_count": 2, "comparison_id": "seed-registry::test", "failed": 0, "failure_categories": {}, "mean_premise_recall": 1.0, "mean_reward": 10.1, "pass_rate": 1.0, "passed": 2, "rows": [{"agent_key": "seed-registry", "allowed_placeholders": [], "difficulty": "S3", "domain_tags": ["erm_consistency", "asymptotic_calculus"], "effective_status": "accepted", "expected_premises": ["StatInference.oracle_ineq_of_uniform_deviation"], "failure_category": null, "first_error": null, "passed": true, "premise_recall": 1.0, "premises_used": ["StatInference.oracle_ineq_of_uniform_deviation"], "reported_status": "accepted", "reward": 10.1, "reward_components": {"closed_goals": 0.0, "locally_valid_steps": 0.0, "premises_used": 0.1, "proof_complete": 10.0}, "split": "test", "task_id": "erm_zero_deviation_exact_risk_seed", "task_type": "formal_only"}, {"agent_key": "seed-registry", "allowed_placeholders": [], "difficulty": "S1", "domain_tags": ["empirical_process", "donsker"], "effective_status": "accepted", "expected_premises": ["StatInference.DonskerSpec.weak_convergence_statement"], "failure_category": null, "first_error": null, "passed": true, "premise_recall": 1.0, "premises_used": ["StatInference.DonskerSpec.weak_convergence_statement"], "reported_status": "accepted", "reward": 10.1, "reward_components": {"closed_goals": 0.0, "locally_valid_steps": 0.0, "premises_used": 0.1, "proof_complete": 10.0}, "split": "test", "task_id": "donsker_statement_seed", "task_type": "formal_only"}], "split": "test", "status_counts": {"accepted": 2, "error": 0, "rejected": 0, "timeout": 0}, "task_ids": ["erm_zero_deviation_exact_risk_seed", "donsker_statement_seed"]}, "failure_taxonomy": {"failed": 0, "failure_categories": {}, "status_counts": {"accepted": 2, "error": 0, "rejected": 0, "timeout": 0}}, "heldout_domains": ["asymptotic_calculus", "donsker", "empirical_process", "erm_consistency"], "heldout_pass_rate": 1.0, "heldout_task_count": 2, "non_seed_chain_count": 3, "non_seed_chain_pass_rate": 1.0, "non_seed_chain_passed": 3, "non_seed_proof_chains": [{"accepted_task_ids": ["ipw_identification_certificate_seed", "ipw_hajek_scaled_linearization_route_seed", "constant_ipw_hajek_route_seed", "constant_ipw_hajek_exact_target_seed", "paper_quality_ipw_hajek_concrete_chain_seed"], "benchmark_task_ids": ["ipw_identification_certificate_seed", "ipw_hajek_scaled_linearization_route_seed", "constant_ipw_hajek_route_seed", "constant_ipw_hajek_exact_target_seed", "paper_quality_ipw_hajek_concrete_chain_seed"], "chain_id": "ipw_hajek_linearization_chain", "missing_task_ids": [], "name": "IPW/Hajek identification plus scaled linearization", "pass_rate": 1.0, "required_declarations": ["StatInference.IPWHajekLinearizationRoute.identifies", "StatInference.IPWHajekLinearizationRoute.scaledLinearization", "StatInference.constantIPWHajekLinearizationRoute", "StatInference.paperQualityIPWHajekConcreteEstimatorChain"], "source_module": "StatInference.Causal.IPW", "status": "passed"}, {"accepted_task_ids": ["aipw_double_robust_identification_seed", "aipw_product_rate_remainder_seed", "aipw_orthogonal_score_seed", "aipw_second_order_remainder_seed", "trivial_aipw_product_rate_route_seed"], "benchmark_task_ids": ["aipw_double_robust_identification_seed", "aipw_product_rate_remainder_seed", "aipw_orthogonal_score_seed", "aipw_second_order_remainder_seed", "trivial_aipw_product_rate_route_seed"], "chain_id": "aipw_product_rate_chain", "missing_task_ids": [], "name": "AIPW double robustness plus orthogonal product-rate remainder", "pass_rate": 1.0, "required_declarations": ["StatInference.AIPWOrthogonalProductRateRoute.identifies", "StatInference.AIPWOrthogonalProductRateRoute.secondOrderRemainderSmall", "StatInference.trivialAIPWOrthogonalProductRateRoute"], "source_module": "StatInference.Causal.AIPW", "status": "passed"}, {"accepted_task_ids": ["influence_function_normality_route_seed", "influence_function_normality_bridge_seed", "aipw_influence_function_normality_route_seed", "trivial_influence_function_normality_seed", "trivial_aipw_influence_function_normality_seed"], "benchmark_task_ids": ["influence_function_normality_route_seed", "influence_function_normality_bridge_seed", "aipw_influence_function_normality_route_seed", "trivial_influence_function_normality_seed", "trivial_aipw_influence_function_normality_seed"], "chain_id": "influence_function_normality_chain", "missing_task_ids": [], "name": "Influence-function asymptotic-linearity and normality route", "pass_rate": 1.0, "required_declarations": ["StatInference.InfluenceFunctionNormalityRoute.asymptoticLinear", "StatInference.InfluenceFunctionNormalityRoute.asymptoticNormal", "StatInference.AIPWInfluenceFunctionNormalityRoute.asymptoticNormal"], "source_module": "StatInference.Semiparametric.Normality", "status": "passed"}], "notes": "P8.M1 report: held-out baseline rows remain split-based, while non-seed proof chains audit reusable StatInference theorem routes that are not themselves benchmark items.", "report_id": "paper-quality::seed-registry::test", "split": "test"}
